{
  "schemaVersion": 2,
  "operationId": "44444444-4444-4444-8444-444444444444",
  "targetProjectId": "22222222-2222-4222-8222-222222222222",
  "source": {
    "projectId": "11111111-1111-4111-8111-111111111111",
    "fileName": "plan.html",
    "versionId": "55555555-5555-4555-8555-555555555551",
    "contentDigest": "bdff1bf3ba29297228b6ab08c578192e2027274f673937128cd5b258972f36b2",
    "versionState": "historical"
  },
  "sections": [
    {
      "id": "audience",
      "text": "主要计划人群为 22–35 岁城市工作人群，资源分配至少 60%。",
      "textDigest": "91a09b86205ea3caa79de96d4095deb46f6686ea18b3b1126169633dbcd39b1a"
    },
    {
      "id": "strategy",
      "text": "优先通过产品体验和门店场景传达口味价值，不以大额折扣作为核心理由。",
      "textDigest": "c10daff95bbc1c6176520dbdc70114e16b6807efed4593c5eea37ad6f9eea23c"
    }
  ],
  "contextSnapshotId": "33333333-3333-4333-8333-333333333333",
  "productionIntent": "landing-page",
  "initialDraft": "只制作内部预览；CTA 跳转体验说明，不连接真实报名服务。"
}
